{
  "schema_version": "steam-balanced-case-review/v0.1",
  "queue_id": "phase-e-balanced-reasoning-candidates-v1:review",
  "annotation_status": "unreviewed",
  "annotator": null,
  "locked_sha256": null,
  "source_case_set_id": "phase-e-balanced-reasoning-candidates-v1",
  "allowed_verifier_outcomes": [
    "supports",
    "rejects",
    "inconclusive",
    "not_applicable"
  ],
  "instructions": [
    "Judge visible evidence and the proposed action, not the category name.",
    "Rows, identifiers, questions, and tags hide the miner's expected categorical outcome.",
    "A failed support check is inconclusive unless evidence directly contradicts the relation.",
    "Confirm delayed effect only when the first hop opens evidence needed by a later hop.",
    "Never provide a numeric reward, score, probability, confidence, or utility.",
    "Edit the embedded draft case when its question, evidence chain, or legal action is wrong."
  ],
  "reviews": [
    {
      "review_id": "review:5c1ecc717779d9a05fa2",
      "category": "counterevidence",
      "case": {
        "case_id": "review-case:826136bc1a5e7164",
        "overlay_path": "/fs/gamma-projects/vlm-robot/steam_video/memory_graph/outputs/video_holmes_atomic_dev_10/033fKtGdpPc/causal_temporal_overlay.json",
        "overlay_id": "causal_temporal_overlay:video_holmes:train:033fKtGdpPc:q626",
        "question": "Review the proposed counterevidence reasoning path from event:atomic:memory:vh_seg_001:001.",
        "seed_event_ids": [
          "event:atomic:memory:vh_seg_001:001"
        ],
        "missing_roles": [
          "counterevidence"
        ],
        "graph_read_budget": 2,
        "gold_event_ids": [
          "event:atomic:memory:vh_seg_001:001"
        ],
        "acceptable_first_actions": [
          {
            "action_type": "search_counterevidence",
            "source_id": "event:atomic:memory:vh_seg_001:001",
            "target_ids": [],
            "relation": "contradicts"
          }
        ],
        "required_relation_types": [
          "contradicts"
        ],
        "tags": [
          "review_stratum:counterevidence",
          "correction_sensitive",
          "train"
        ],
        "split": "train",
        "notes": "Outcome-blinded diagnostic candidate; judge visible evidence and online action legality."
      },
      "candidate_basis": [
        "review_stratum:counterevidence",
        "candidate_only:not_gold",
        "requires_visible_evidence_review",
        "requires_categorical_verifier_outcome_review"
      ],
      "review_decision": null,
      "verifier_outcome": null,
      "evidence_chain_valid": null,
      "first_action_valid": null,
      "delayed_effect": null,
      "rationale": ""
    },
    {
      "review_id": "review:1cf31fd17b8f7a281d6c",
      "category": "identity",
      "case": {
        "case_id": "review-case:5f6cfb5b63114f71",
        "overlay_path": "/fs/gamma-projects/vlm-robot/steam_video/memory_graph/outputs/video_holmes_atomic_dev_10/033fKtGdpPc/causal_temporal_overlay.json",
        "overlay_id": "causal_temporal_overlay:video_holmes:train:033fKtGdpPc:q626",
        "question": "Review the proposed identity reasoning path from event:atomic:memory:vh_seg_002:006.",
        "seed_event_ids": [
          "event:atomic:memory:vh_seg_002:006"
        ],
        "missing_roles": [
          "identity"
        ],
        "graph_read_budget": 2,
        "gold_event_ids": [
          "event:atomic:memory:vh_seg_002:006",
          "event:atomic:memory:vh_seg_006:006"
        ],
        "acceptable_first_actions": [
          {
            "action_type": "track_entity",
            "source_id": "event:atomic:memory:vh_seg_002:006",
            "target_ids": [
              "event:atomic:memory:vh_seg_006:006"
            ],
            "relation": "same_entity"
          }
        ],
        "required_relation_types": [
          "same_entity"
        ],
        "tags": [
          "review_stratum:identity",
          "correction_sensitive",
          "train"
        ],
        "split": "train",
        "notes": "Outcome-blinded diagnostic candidate; judge visible evidence and online action legality."
      },
      "candidate_basis": [
        "review_stratum:identity",
        "candidate_only:not_gold",
        "requires_visible_evidence_review",
        "requires_categorical_verifier_outcome_review"
      ],
      "review_decision": null,
      "verifier_outcome": null,
      "evidence_chain_valid": null,
      "first_action_valid": null,
      "delayed_effect": null,
      "rationale": ""
    },
    {
      "review_id": "review:1ec1911b8aae16553782",
      "category": "counterevidence",
      "case": {
        "case_id": "review-case:6b9eca66b80dfc10",
        "overlay_path": "/fs/gamma-projects/vlm-robot/steam_video/memory_graph/outputs/video_holmes_atomic_dev_10/-3l2KFTj7yY/causal_temporal_overlay.json",
        "overlay_id": "causal_temporal_overlay:video_holmes:train:-3l2KFTj7yY:q735",
        "question": "Review the proposed counterevidence reasoning path from event:atomic:memory:vh_seg_001:001.",
        "seed_event_ids": [
          "event:atomic:memory:vh_seg_001:001"
        ],
        "missing_roles": [
          "counterevidence"
        ],
        "graph_read_budget": 2,
        "gold_event_ids": [
          "event:atomic:memory:vh_seg_001:001"
        ],
        "acceptable_first_actions": [
          {
            "action_type": "search_counterevidence",
            "source_id": "event:atomic:memory:vh_seg_001:001",
            "target_ids": [],
            "relation": "contradicts"
          }
        ],
        "required_relation_types": [
          "contradicts"
        ],
        "tags": [
          "review_stratum:counterevidence",
          "correction_sensitive",
          "dev"
        ],
        "split": "dev",
        "notes": "Outcome-blinded diagnostic candidate; judge visible evidence and online action legality."
      },
      "candidate_basis": [
        "review_stratum:counterevidence",
        "candidate_only:not_gold",
        "requires_visible_evidence_review",
        "requires_categorical_verifier_outcome_review"
      ],
      "review_decision": null,
      "verifier_outcome": null,
      "evidence_chain_valid": null,
      "first_action_valid": null,
      "delayed_effect": null,
      "rationale": ""
    },
    {
      "review_id": "review:b9c0f12c8eade0f0a0fc",
      "category": "identity",
      "case": {
        "case_id": "review-case:8a99115a64e12d3c",
        "overlay_path": "/fs/gamma-projects/vlm-robot/steam_video/memory_graph/outputs/video_holmes_atomic_dev_10/033fKtGdpPc/causal_temporal_overlay.json",
        "overlay_id": "causal_temporal_overlay:video_holmes:train:033fKtGdpPc:q626",
        "question": "Review the proposed identity reasoning path from event:atomic:memory:vh_seg_005:006.",
        "seed_event_ids": [
          "event:atomic:memory:vh_seg_005:006"
        ],
        "missing_roles": [
          "identity"
        ],
        "graph_read_budget": 2,
        "gold_event_ids": [
          "event:atomic:memory:vh_seg_005:006",
          "event:atomic:memory:vh_seg_006:003"
        ],
        "acceptable_first_actions": [
          {
            "action_type": "track_entity",
            "source_id": "event:atomic:memory:vh_seg_005:006",
            "target_ids": [
              "event:atomic:memory:vh_seg_006:003"
            ],
            "relation": "same_entity"
          }
        ],
        "required_relation_types": [
          "same_entity"
        ],
        "tags": [
          "review_stratum:identity",
          "correction_sensitive",
          "train"
        ],
        "split": "train",
        "notes": "Outcome-blinded diagnostic candidate; judge visible evidence and online action legality."
      },
      "candidate_basis": [
        "review_stratum:identity",
        "candidate_only:not_gold",
        "requires_visible_evidence_review",
        "requires_categorical_verifier_outcome_review"
      ],
      "review_decision": null,
      "verifier_outcome": null,
      "evidence_chain_valid": null,
      "first_action_valid": null,
      "delayed_effect": null,
      "rationale": ""
    },
    {
      "review_id": "review:f75c7671cb2aa897a025",
      "category": "identity",
      "case": {
        "case_id": "review-case:b6ccc24367ef010d",
        "overlay_path": "/fs/gamma-projects/vlm-robot/steam_video/memory_graph/outputs/video_holmes_structured_state_embedding_smoke_v1/memory_graph/mKqiGQrHtW8/causal_temporal_overlay.json",
        "overlay_id": "causal_temporal_overlay:video_holmes:train:mKqiGQrHtW8:q684",
        "question": "Review the proposed identity reasoning path from event:atomic:video_skills_l1:00208.",
        "seed_event_ids": [
          "event:atomic:video_skills_l1:00208"
        ],
        "missing_roles": [
          "identity"
        ],
        "graph_read_budget": 2,
        "gold_event_ids": [
          "event:atomic:video_skills_l1:00208",
          "event:atomic:video_skills_l1:00214"
        ],
        "acceptable_first_actions": [
          {
            "action_type": "track_entity",
            "source_id": "event:atomic:video_skills_l1:00208",
            "target_ids": [
              "event:atomic:video_skills_l1:00214"
            ],
            "relation": "same_entity"
          }
        ],
        "required_relation_types": [
          "same_entity"
        ],
        "tags": [
          "review_stratum:identity",
          "correction_sensitive",
          "test"
        ],
        "split": "test",
        "notes": "Outcome-blinded diagnostic candidate; judge visible evidence and online action legality."
      },
      "candidate_basis": [
        "review_stratum:identity",
        "candidate_only:not_gold",
        "requires_visible_evidence_review",
        "requires_categorical_verifier_outcome_review"
      ],
      "review_decision": null,